{"agent":{"name":"independent-review","version":"1.1.0"},"context":{"include_specification":true,"include_task":true,"maximum_context_tokens":160000,"repository_selection":"kernel_selected"},"metadata":{"description":"Independent evidence-based review proposal agent","labels":["golden","review"]},"model":{"capability_class":"independent_review","maximum_output_tokens":16000,"temperature":0},"output":{"schema":"review_proposal.v1"},"prompt":{"artifact_uri":"artifact://sha256/650b912ee2c8e07faac7b10da90d5288e31c62a33d7b21121c6b1f0f52b5f286","sha256":"650b912ee2c8e07faac7b10da90d5288e31c62a33d7b21121c6b1f0f52b5f286"},"schema_version":"1","stage":"review","tools":{"allowed_requests":["read_repository_file","report_blocker","request_declared_check","search_repository"],"arbitrary_network":false,"arbitrary_shell":false,"direct_file_write":false}}
