{"agent":{"name":"bounded-implementation","version":"1.1.0"},"context":{"include_specification":true,"include_task":true,"maximum_context_tokens":100000,"repository_selection":"kernel_selected"},"metadata":{"description":"Golden implementation agent","labels":["golden"]},"model":{"capability_class":"strong_coding","maximum_output_tokens":20000,"temperature":0.1},"output":{"schema":"implementation_proposal.v1"},"prompt":{"artifact_uri":"artifact://sha256/4bf26198d0ab9bb7252e5fa5d4626aeab6b6ad25fe491e0f945e2c3d3d88da49","sha256":"4bf26198d0ab9bb7252e5fa5d4626aeab6b6ad25fe491e0f945e2c3d3d88da49"},"schema_version":"1","stage":"implementation","tools":{"allowed_requests":["read_repository_file","report_blocker","request_declared_check","search_repository"],"arbitrary_network":false,"arbitrary_shell":false,"direct_file_write":false}}
