{"agent":{"name":"bounded-planning","version":"1.1.0"},"context":{"include_specification":true,"include_task":false,"maximum_context_tokens":140000,"repository_selection":"kernel_selected"},"metadata":{"description":"Bounded task-graph proposal agent","labels":["golden","planning"]},"model":{"capability_class":"general_reasoning","maximum_output_tokens":16000,"temperature":0.1},"output":{"schema":"task_graph_proposal.v1"},"prompt":{"artifact_uri":"artifact://sha256/b1ce51fca75bead1a680290cde08c3af5e6b70f05de0a8912aedcaf5dc3a4889","sha256":"b1ce51fca75bead1a680290cde08c3af5e6b70f05de0a8912aedcaf5dc3a4889"},"schema_version":"1","stage":"planning","tools":{"allowed_requests":["read_repository_file","report_blocker","request_declared_check","search_repository"],"arbitrary_network":false,"arbitrary_shell":false,"direct_file_write":false}}
