{"agent":{"name":"bounded-specification","version":"1.1.0"},"context":{"include_specification":false,"include_task":false,"maximum_context_tokens":120000,"repository_selection":"kernel_selected"},"metadata":{"description":"Bounded specification proposal agent","labels":["golden","specification"]},"model":{"capability_class":"general_reasoning","maximum_output_tokens":12000,"temperature":0.2},"output":{"schema":"specification_proposal.v1"},"prompt":{"artifact_uri":"artifact://sha256/41330a0c61d30fdb3f96a85d6742a529b0094d8889b93ce7b7aff74bcf1cf6da","sha256":"41330a0c61d30fdb3f96a85d6742a529b0094d8889b93ce7b7aff74bcf1cf6da"},"schema_version":"1","stage":"specification","tools":{"allowed_requests":["read_repository_file","report_blocker","search_repository"],"arbitrary_network":false,"arbitrary_shell":false,"direct_file_write":false}}
